Id,ProductId,UserId,ProfileName,HelpfulnessNumerator,HelpfulnessDenominator,Score,Time,Summary,Text
1965,B001FQ0UEE,ABWUZU0SCL5PW,Howard M.,2,2,5,1313539200,Absolutely wonderful,"A family favorite.  These are really unique treats.  The wonderful taste of flowers.  The violet and rose are great.  Orange blossom wasn't to my liking.  The company that makes them have been around for hundreds of years.  They are made in a small French town that was featured in a movie called ""Chocolat."""
1620,B001RVFDOO,ATGKNPXJIBE42,Carol Sausen,0,0,4,1322006400,I like all but one,"I like all the varieties except the salt and pepper.  They taste too much like black pepper and nothing else.  The others are very goodl<a href=""http://www.amazon.com/gp/product/B001RVFDOO"">Popchips 6-Flavor Variety Pack, 0.8-Ounce Single Serve Bags (Pack of 24)</a>"
4600,B0013ENGXK,A1B0ZKGS0ZAHQW,"V. Mcknelly ""weiserv""",0,0,5,1174003200,Use it every day,"I drink this tea every day (I'm 7 months pregnant), and have done so since I found out I was pregnant.  I love that it's organic and contains all the herbs that support a healthy pregnancy.  I don't notice anything dramatic when I drink it or don't drink it, but I will say I feel nourished when I drink it, and have had NO PREGNANCY COMPLICATIONS WHATSOEVER.  I'm 36, this is my first pregnancy, and I have been exceptionally healthy throughout.  I highly recommend this for any pregnant woman--at least a cup a day!"
4277,B004391DK0,AJK1BSTTTO4F6,Alan W Corley,0,0,5,1290643200,Love me some gluten free bisquick!!!,"We just bought this the other day because for about 2 years we have found that biscuits are a very hard wheat/gluten free item to make...I LOVE IT!!! I even went further and put holes in the middle of the biscuit dough, flattened them a bit and then fried them in a bit of oil, sprinkled with sugar and had DOUGHNUTS! My 3 year old feels like he is getting a treat!"
812,B0030C9A60,APNMGFU73W7ZC,Sharon Knibbe,0,0,5,1323388800,Scottie,The holiday liquor cups were exactly what I was looking for.  The chocolate is<br />delicious and holds up well to the liquors
9131,B006N3IG4K,AHRASE2UFPFKK,Tom T,0,0,4,1330214400,Wolfgang's Hazlenut,"This one is my wife's favorite of all the Hazlenut blends she has tried. This is her ""go to"" after a busy day of being retired.<br />Delivery was exceptional as usual, could not ask for much more."
